"Status","Start Time","Stop Time","Duration in ms","Parent Suite","Suite","Sub Suite","Test Class","Test Method","Name","Description"
"failed","Mon Sep 11 02:51:12 CEST 2023","Mon Sep 11 02:51:15 CEST 2023","2981","chromium","basket.spec.js","basket testing","","","Add first item without discount to basket and open it",""
"failed","Mon Sep 11 02:51:03 CEST 2023","Mon Sep 11 02:51:11 CEST 2023","8303","chromium","basket.spec.js","basket testing","","","Check basket is opened",""
"broken","Mon Sep 11 02:51:23 CEST 2023","Mon Sep 11 02:51:53 CEST 2023","30224","chromium","basket.spec.js","basket testing","","","Add all items to basket and open it",""
"failed","Mon Sep 11 02:51:15 CEST 2023","Mon Sep 11 02:51:23 CEST 2023","8188","chromium","basket.spec.js","basket testing","","","Add first item with discount to basket and open it",""
"broken","Mon Sep 11 02:51:54 CEST 2023","Mon Sep 11 02:52:24 CEST 2023","30167","chromium","basket.spec.js","basket testing","","","Add 9 items with discount to basket and open it",""
